{
  "schema_version": "1.0",
  "board_id": "qnet_public_014_board_v1",
  "width": 1400,
  "height": 900,
  "routing_margin": 36,
  "routing_channels": [
    {
      "channel_id": "top_lane",
      "channel_type": "horizontal",
      "x": 45,
      "y": 145,
      "width": 1310,
      "height": 35
    },
    {
      "channel_id": "middle_lane",
      "channel_type": "horizontal",
      "x": 45,
      "y": 425,
      "width": 1310,
      "height": 35
    },
    {
      "channel_id": "bottom_lane",
      "channel_type": "horizontal",
      "x": 45,
      "y": 735,
      "width": 1310,
      "height": 35
    },
    {
      "channel_id": "left_outer",
      "channel_type": "left_outer",
      "x": 20,
      "y": 30,
      "width": 35,
      "height": 835
    },
    {
      "channel_id": "right_outer",
      "channel_type": "right_outer",
      "x": 1345,
      "y": 30,
      "width": 35,
      "height": 835
    }
  ],
  "forbidden_areas": [
    {
      "area_id": "TB5_body",
      "x": 110,
      "y": 45,
      "width": 1180,
      "height": 70
    },
    {
      "area_id": "MCCB_body",
      "x": 90,
      "y": 210,
      "width": 160,
      "height": 150
    },
    {
      "area_id": "EOCR_body",
      "x": 300,
      "y": 210,
      "width": 160,
      "height": 150
    },
    {
      "area_id": "F_body",
      "x": 510,
      "y": 210,
      "width": 120,
      "height": 150
    },
    {
      "area_id": "X1_body",
      "x": 700,
      "y": 200,
      "width": 180,
      "height": 170
    },
    {
      "area_id": "X2_body",
      "x": 990,
      "y": 200,
      "width": 180,
      "height": 170
    },
    {
      "area_id": "T2_body",
      "x": 90,
      "y": 500,
      "width": 180,
      "height": 170
    },
    {
      "area_id": "MC1_body",
      "x": 350,
      "y": 500,
      "width": 220,
      "height": 170
    },
    {
      "area_id": "MC2_body",
      "x": 680,
      "y": 500,
      "width": 220,
      "height": 170
    },
    {
      "area_id": "T1_body",
      "x": 1010,
      "y": 500,
      "width": 180,
      "height": 170
    },
    {
      "area_id": "TB6_body",
      "x": 110,
      "y": 785,
      "width": 1180,
      "height": 70
    }
  ],
  "items": [
    {
      "item_id": "TB5",
      "label": "TB5 (10P+10P)",
      "item_type": "terminal_block",
      "socket_type_id": null,
      "row": 0,
      "x": 110,
      "y": 45,
      "width": 1180,
      "height": 70,
      "pins": [
        {
          "terminal_id": "TB5-01",
          "label": "1",
          "number": null,
          "side": "bottom",
          "x": 139.5,
          "y": 115,
          "max_connections": 2,
          "enabled": true,
          "terminal_role": "free_junction"
        },
        {
          "terminal_id": "TB5-02",
          "label": "2",
          "number": null,
          "side": "bottom",
          "x": 198.5,
          "y": 115,
          "max_connections": 2,
          "enabled": true,
          "terminal_role": "free_junction"
        },
        {
          "terminal_id": "TB5-03",
          "label": "3",
          "number": null,
          "side": "bottom",
          "x": 257.5,
          "y": 115,
          "max_connections": 2,
          "enabled": true,
          "terminal_role": "free_junction"
        },
        {
          "terminal_id": "TB5-04",
          "label": "4",
          "number": null,
          "side": "bottom",
          "x": 316.5,
          "y": 115,
          "max_connections": 2,
          "enabled": true,
          "terminal_role": "free_junction"
        },
        {
          "terminal_id": "TB5-05",
          "label": "5",
          "number": null,
          "side": "bottom",
          "x": 375.5,
          "y": 115,
          "max_connections": 2,
          "enabled": true,
          "terminal_role": "free_junction"
        },
        {
          "terminal_id": "TB5-06",
          "label": "6",
          "number": null,
          "side": "bottom",
          "x": 434.5,
          "y": 115,
          "max_connections": 2,
          "enabled": true,
          "terminal_role": "free_junction"
        },
        {
          "terminal_id": "TB5-07",
          "label": "7",
          "number": null,
          "side": "bottom",
          "x": 493.5,
          "y": 115,
          "max_connections": 2,
          "enabled": true,
          "terminal_role": "free_junction"
        },
        {
          "terminal_id": "TB5-08",
          "label": "8",
          "number": null,
          "side": "bottom",
          "x": 552.5,
          "y": 115,
          "max_connections": 2,
          "enabled": true,
          "terminal_role": "free_junction"
        },
        {
          "terminal_id": "TB5-09",
          "label": "9",
          "number": null,
          "side": "bottom",
          "x": 611.5,
          "y": 115,
          "max_connections": 2,
          "enabled": true,
          "terminal_role": "free_junction"
        },
        {
          "terminal_id": "TB5-10",
          "label": "10",
          "number": null,
          "side": "bottom",
          "x": 670.5,
          "y": 115,
          "max_connections": 2,
          "enabled": true,
          "terminal_role": "free_junction"
        },
        {
          "terminal_id": "TB5-11",
          "label": "11",
          "number": null,
          "side": "bottom",
          "x": 729.5,
          "y": 115,
          "max_connections": 2,
          "enabled": true,
          "terminal_role": "free_junction"
        },
        {
          "terminal_id": "TB5-12",
          "label": "12",
          "number": null,
          "side": "bottom",
          "x": 788.5,
          "y": 115,
          "max_connections": 2,
          "enabled": true,
          "terminal_role": "free_junction"
        },
        {
          "terminal_id": "TB5-13",
          "label": "13",
          "number": null,
          "side": "bottom",
          "x": 847.5,
          "y": 115,
          "max_connections": 2,
          "enabled": true,
          "terminal_role": "free_junction"
        },
        {
          "terminal_id": "TB5-14",
          "label": "14",
          "number": null,
          "side": "bottom",
          "x": 906.5,
          "y": 115,
          "max_connections": 2,
          "enabled": true,
          "terminal_role": "free_junction"
        },
        {
          "terminal_id": "TB5-15",
          "label": "15",
          "number": null,
          "side": "bottom",
          "x": 965.5,
          "y": 115,
          "max_connections": 2,
          "enabled": true,
          "terminal_role": "free_junction"
        },
        {
          "terminal_id": "TB5-16",
          "label": "16",
          "number": null,
          "side": "bottom",
          "x": 1024.5,
          "y": 115,
          "max_connections": 2,
          "enabled": true,
          "terminal_role": "free_junction"
        },
        {
          "terminal_id": "TB5-17",
          "label": "17",
          "number": null,
          "side": "bottom",
          "x": 1083.5,
          "y": 115,
          "max_connections": 2,
          "enabled": true,
          "terminal_role": "free_junction"
        },
        {
          "terminal_id": "TB5-18",
          "label": "18",
          "number": null,
          "side": "bottom",
          "x": 1142.5,
          "y": 115,
          "max_connections": 2,
          "enabled": true,
          "terminal_role": "free_junction"
        },
        {
          "terminal_id": "TB5-19",
          "label": "19",
          "number": null,
          "side": "bottom",
          "x": 1201.5,
          "y": 115,
          "max_connections": 2,
          "enabled": true,
          "terminal_role": "free_junction"
        },
        {
          "terminal_id": "TB5-20",
          "label": "20",
          "number": null,
          "side": "bottom",
          "x": 1260.5,
          "y": 115,
          "max_connections": 2,
          "enabled": true,
          "terminal_role": "free_junction"
        }
      ],
      "label_area": {
        "x": 570.2,
        "y": 65,
        "width": 259.6,
        "height": 30
      }
    },
    {
      "item_id": "F",
      "label": "FUSE",
      "item_type": "component",
      "socket_type_id": null,
      "row": 1,
      "x": 90,
      "y": 210,
      "width": 120,
      "height": 150,
      "pins": [
        {
          "terminal_id": "F-1",
          "label": "1",
          "number": null,
          "side": "top",
          "x": 150,
          "y": 210,
          "max_connections": 2,
          "enabled": true,
          "terminal_role": "functional"
        },
        {
          "terminal_id": "F-2",
          "label": "2",
          "number": null,
          "side": "bottom",
          "x": 150,
          "y": 360,
          "max_connections": 2,
          "enabled": true,
          "terminal_role": "functional"
        }
      ],
      "label_area": {
        "x": 112,
        "y": 264,
        "width": 76,
        "height": 42
      }
    },
    {
      "item_id": "MCCB",
      "label": "MCCB",
      "item_type": "component",
      "socket_type_id": null,
      "row": 1,
      "x": 315,
      "y": 210,
      "width": 160,
      "height": 150,
      "pins": [
        {
          "terminal_id": "MCCB-L1",
          "label": "L1",
          "number": null,
          "side": "top",
          "x": 341.67,
          "y": 210,
          "max_connections": 2,
          "enabled": true,
          "terminal_role": "functional"
        },
        {
          "terminal_id": "MCCB-L2",
          "label": "L2",
          "number": null,
          "side": "top",
          "x": 395,
          "y": 210,
          "max_connections": 2,
          "enabled": true,
          "terminal_role": "functional"
        },
        {
          "terminal_id": "MCCB-L3",
          "label": "L3",
          "number": null,
          "side": "top",
          "x": 448.33000000000004,
          "y": 210,